series_title,released_year,certificate,runtime,genre,imdb_rating,overview,meta_score,director,star1,star2,star3,star4,no_of_votes,gross
The Hustler,1961,A,134,"['Drama', 'Sport']",8.0,An up-and-coming pool player plays a long-time champion in a single high-stakes match.,90.0,Robert Rossen,Paul Newman,Jackie Gleason,Piper Laurie,George C. Scott,75067,8284000.0
October Sky,1999,PG,108,"['Biography', 'Drama', 'Family']",7.8,"The true story of Homer Hickam, a coal miner's son who was inspired by the first Sputnik launch to take up rocketry against his father's wishes.",71.0,Joe Johnston,Jake Gyllenhaal,Chris Cooper,Laura Dern,Chris Owen,82855,32481825.0
Almost Famous,2000,A,122,"['Adventure', 'Comedy', 'Drama']",7.9,A high-school boy is given the chance to write a story for Rolling Stone Magazine about an up-and-coming rock band as he accompanies them on their concert tour.,90.0,Cameron Crowe,Billy Crudup,Patrick Fugit,Kate Hudson,Frances McDormand,252586,32534850.0
Rope,1948,A,80,"['Crime', 'Drama', 'Mystery']",8.0,Two men attempt to prove they committed the perfect crime by hosting a dinner party after strangling their former classmate to death.,73.0,Alfred Hitchcock,James Stewart,John Dall,Farley Granger,Dick Hogan,129783,22350918.5
Moon,2009,R,97,"['Drama', 'Mystery', 'Sci-Fi']",7.9,"Astronaut Sam Bell has a quintessentially personal encounter toward the end of his three-year stint on the Moon, where he, working alongside his computer, GERTY, sends back to Earth parcels of a resource that has helped diminish our planet's power problems.",67.0,Duncan Jones,Sam Rockwell,Kevin Spacey,Dominique McElligott,Rosie Shaw,335152,5009677.0
G.O.R.A.,2004,Unrated,127,"['Adventure', 'Comedy', 'Sci-Fi']",8.0,A slick young Turk kidnapped by extraterrestrials shows his great « humanitarian spirit » by outwitting the evil commander-in-chief of the planet of G.O.R.A.,80.0,Ömer Faruk Sorak,Cem Yilmaz,Özge Özberk,Ozan Güven,Safak Sezer,56960,22350918.5
Kind Hearts and Coronets,1949,U,106,"['Comedy', 'Crime']",8.0,A distant poor relative of the Duke D'Ascoyne plots to inherit the title by murdering the eight other heirs who stand ahead of him in the line of succession.,80.0,Robert Hamer,Dennis Price,Alec Guinness,Valerie Hobson,Joan Greenwood,34485,22350918.5
A Few Good Men,1992,U,138,"['Drama', 'Thriller']",7.7,Military lawyer Lieutenant Daniel Kaffee defends Marines accused of murder. They contend they were acting under orders.,62.0,Rob Reiner,Tom Cruise,Jack Nicholson,Demi Moore,Kevin Bacon,235388,141340178.0
Boogie Nights,1997,R,155,['Drama'],7.9,"Back when sex was safe, pleasure was a business and business was booming, an idealistic porn producer aspires to elevate his craft to an art when he discovers a hot young talent.",85.0,Paul Thomas Anderson,Mark Wahlberg,Julianne Moore,Burt Reynolds,Luis Guzmán,239473,26400640.0
Interstate 60: Episodes of the Road,2002,R,116,"['Adventure', 'Comedy', 'Drama']",7.7,"Neal Oliver, a very confused young man and an artist, takes a journey of a lifetime on a highway I60 that doesn't exist on any of the maps, going to the places he never even heard of, searching for an answer and his dreamgirl.",80.0,Bob Gale,James Marsden,Gary Oldman,Kurt Russell,Matthew Edison,29999,22350918.5
Jodaeiye Nader az Simin,2011,PG-13,123,['Drama'],8.3,A married couple are faced with a difficult decision - to improve the life of their child by moving to another country or to stay in Iran and look after a deteriorating parent who has Alzheimer's disease.,95.0,Asghar Farhadi,Payman Maadi,Leila Hatami,Sareh Bayat,Shahab Hosseini,220002,7098492.0
3 Idiots,2009,UA,170,"['Comedy', 'Drama']",8.4,"Two friends are searching for their long lost companion. They revisit their college days and recall the memories of their friend who inspired them to think differently, even as the rest of the world called them ""idiots"".",67.0,Rajkumar Hirani,Aamir Khan,Madhavan,Mona Singh,Sharman Joshi,344445,6532908.0
Barton Fink,1991,U,116,"['Comedy', 'Drama', 'Thriller']",7.7,A renowned New York playwright is enticed to California to write for the movies and discovers the hellish truth of Hollywood.,69.0,Joel Coen,Ethan Coen,John Turturro,John Goodman,Judy Davis,113240,6153939.0
Drive,2011,A,100,"['Crime', 'Drama']",7.8,A mysterious Hollywood stuntman and mechanic moonlights as a getaway driver and finds himself in trouble when he helps out his neighbor.,78.0,Nicolas Winding Refn,Ryan Gosling,Carey Mulligan,Bryan Cranston,Albert Brooks,571571,35061555.0
Halloween,1978,A,91,"['Horror', 'Thriller']",7.7,"Fifteen years after murdering his sister on Halloween night 1963, Michael Myers escapes from a mental hospital and returns to the small town of Haddonfield, Illinois to kill again.",87.0,John Carpenter,Donald Pleasence,Jamie Lee Curtis,Tony Moran,Nancy Kyes,233106,47000000.0
