series_title,released_year,certificate,runtime,genre,imdb_rating,overview,meta_score,director,star1,star2,star3,star4,no_of_votes,gross
The Best Years of Our Lives,1946,Approved,170,"['Drama', 'Romance', 'War']",8.0,Three World War II veterans return home to small-town America to discover that they and their families have been irreparably changed.,93.0,William Wyler,Myrna Loy,Dana Andrews,Fredric March,Teresa Wright,57259,23650000.0
Hedwig and the Angry Inch,2001,R,95,"['Comedy', 'Drama', 'Music']",7.7,A gender-queer punk-rock singer from East Berlin tours the U.S. with her band as she tells her life story and follows the former lover/band-mate who stole her songs.,85.0,John Cameron Mitchell,John Cameron Mitchell,Miriam Shor,Stephen Trask,Theodore Liscinski,31957,3029081.0
Gone Girl,2014,A,149,"['Drama', 'Mystery', 'Thriller']",8.1,"With his wife's disappearance having become the focus of an intense media circus, a man sees the spotlight turned on him when it's suspected that he may not be innocent.",79.0,David Fincher,Ben Affleck,Rosamund Pike,Neil Patrick Harris,Tyler Perry,859695,167767189.0
The Red Shoes,1948,Unrated,135,"['Drama', 'Music', 'Romance']",8.1,A young ballet dancer is torn between the man she loves and her pursuit to become a prima ballerina.,80.0,Michael Powell,Emeric Pressburger,Anton Walbrook,Marius Goring,Moira Shearer,30935,10900000.0
Le Petit Prince,2015,PG,108,"['Animation', 'Adventure', 'Drama']",7.7,"A little girl lives in a very grown-up world with her mother, who tries to prepare her for it. Her neighbor, the Aviator, introduces the girl to an extraordinary world where anything is possible, the world of the Little Prince.",70.0,Mark Osborne,Jeff Bridges,Mackenzie Foy,Rachel McAdams,Marion Cotillard,56720,1339152.0
M.S. Dhoni: The Untold Story,2016,U,184,"['Biography', 'Drama', 'Sport']",7.8,The untold story of Mahendra Singh Dhoni's journey from ticket collector to trophy collector - the world-cup-winning captain of the Indian Cricket Team.,80.0,Neeraj Pandey,Sushant Singh Rajput,Kiara Advani,Anupam Kher,Disha Patani,40416,1782795.0
Hell or High Water,2016,R,102,"['Action', 'Crime', 'Drama']",7.6,A divorced father and his ex-con older brother resort to a desperate scheme in order to save their family's ranch in West Texas.,88.0,David Mackenzie,Chris Pine,Ben Foster,Jeff Bridges,Gil Birmingham,204175,26862450.0
In the Heat of the Night,1967,U,110,"['Crime', 'Drama', 'Mystery']",7.9,A black police detective is asked to investigate a murder in a racially hostile southern town.,75.0,Norman Jewison,Sidney Poitier,Rod Steiger,Warren Oates,Lee Grant,67804,24379978.0
Anatomy of a Murder,1959,Unrated,161,"['Crime', 'Drama', 'Mystery']",8.0,"In a murder trial, the defendant says he suffered temporary insanity after the victim raped his wife. What is the truth, and will he win his case?",95.0,Otto Preminger,James Stewart,Lee Remick,Ben Gazzara,Arthur O'Connell,59847,11900000.0
Ferris Bueller's Day Off,1986,U,103,['Comedy'],7.8,"A high school wise guy is determined to have a day off from school, despite what the Principal thinks of that.",61.0,John Hughes,Matthew Broderick,Alan Ruck,Mia Sara,Jeffrey Jones,321382,70136369.0
Un long dimanche de fiançailles,2004,U,133,"['Drama', 'Mystery', 'Romance']",7.6,"Tells the story of a young woman's relentless search for her fiancé, who has disappeared from the trenches of the Somme during World War One.",76.0,Jean-Pierre Jeunet,Audrey Tautou,Gaspard Ulliel,Jodie Foster,Dominique Pinon,70925,6167817.0
Ondskan,2003,Unrated,113,['Drama'],7.8,"A teenage boy expelled from school for fighting arrives at a boarding school where the systematic bullying of younger students is encouraged as a means to maintain discipline, and decides to fight back.",61.0,Mikael Håfström,Andreas Wilson,Henrik Lundström,Gustaf Skarsgård,Linda Zilliacus,35682,15280.0
Invasion of the Body Snatchers,1956,Approved,80,"['Drama', 'Horror', 'Sci-Fi']",7.7,A small-town doctor learns that the population of his community is being replaced by emotionless alien duplicates.,92.0,Don Siegel,Kevin McCarthy,Dana Wynter,Larry Gates,King Donovan,44839,22350918.5
Captain Phillips,2013,UA,134,"['Adventure', 'Biography', 'Crime']",7.8,"The true story of Captain Richard Phillips and the 2009 hijacking by Somali pirates of the U.S.-flagged MV Maersk Alabama, the first American cargo ship to be hijacked in two hundred years.",82.0,Paul Greengrass,Tom Hanks,Barkhad Abdi,Barkhad Abdirahman,Catherine Keener,421244,107100855.0
God's Own Country,2017,Unrated,104,"['Drama', 'Romance']",7.7,"Spring. Yorkshire. Young farmer Johnny Saxby numbs his daily frustrations with binge drinking and casual sex, until the arrival of a Romanian migrant worker for lambing season ignites an intense relationship that sets Johnny on a new path.",85.0,Francis Lee,Josh O'Connor,Alec Secareanu,Gemma Jones,Ian Hart,25198,335609.0
Once Upon a Time in America,1984,A,229,"['Crime', 'Drama']",8.4,"A former Prohibition-era Jewish gangster returns to the Lower East Side of Manhattan over thirty years later, where he once again must confront the ghosts and regrets of his old life.",80.0,Sergio Leone,Robert De Niro,James Woods,Elizabeth McGovern,Treat Williams,311365,5321508.0
Fried Green Tomatoes,1991,PG-13,130,['Drama'],7.7,A housewife who is unhappy with her life befriends an old lady in a nursing home and is enthralled by the tales she tells of people she used to know.,64.0,Jon Avnet,Kathy Bates,Jessica Tandy,Mary Stuart Masterson,Mary-Louise Parker,66941,82418501.0
Isle of Dogs,2018,U,101,"['Animation', 'Adventure', 'Comedy']",7.9,"Set in Japan, Isle of Dogs follows a boy's odyssey in search of his lost dog.",82.0,Wes Anderson,Bryan Cranston,Koyu Rankin,Edward Norton,Bob Balaban,139114,32015231.0
Magnolia,1999,R,188,['Drama'],8.0,"An epic mosaic of interrelated characters in search of love, forgiveness, and meaning in the San Fernando Valley.",77.0,Paul Thomas Anderson,Tom Cruise,Jason Robards,Julianne Moore,Philip Seymour Hoffman,289742,22455976.0
The Grand Budapest Hotel,2014,UA,99,"['Adventure', 'Comedy', 'Crime']",8.1,"A writer encounters the owner of an aging high-class hotel, who tells him of his early years serving as a lobby boy in the hotel's glorious years under an exceptional concierge.",88.0,Wes Anderson,Ralph Fiennes,F. Murray Abraham,Mathieu Amalric,Adrien Brody,707630,59100318.0
Sound of Metal,2019,R,120,"['Drama', 'Music']",7.8,A heavy-metal drummer's life is thrown into freefall when he begins to lose his hearing.,81.0,Darius Marder,Riz Ahmed,Olivia Cooke,Paul Raci,Lauren Ridloff,27187,22350918.5
The Incredibles,2004,U,115,"['Animation', 'Action', 'Adventure']",8.0,"A family of undercover superheroes, while trying to live the quiet suburban life, are forced into action to save the world.",90.0,Brad Bird,Craig T. Nelson,Samuel L. Jackson,Holly Hunter,Jason Lee,657047,261441092.0
El cuerpo,2012,Unrated,112,"['Mystery', 'Thriller']",7.6,A detective searches for the body of a femme fatale which has gone missing from a morgue.,80.0,Oriol Paulo,Jose Coronado,Hugo Silva,Belén Rueda,Aura Garrido,57549,22350918.5
Baby Driver,2017,UA,113,"['Action', 'Crime', 'Drama']",7.6,"After being coerced into working for a crime boss, a young getaway driver finds himself taking part in a heist doomed to fail.",86.0,Edgar Wright,Ansel Elgort,Jon Bernthal,Jon Hamm,Eiza González,439406,107825862.0
Kari-gurashi no Arietti,2010,U,94,"['Animation', 'Adventure', 'Family']",7.6,"The Clock family are four-inch-tall people who live anonymously in another family's residence, borrowing simple items to make their home. Life changes for the Clocks when their teenage daughter, Arrietty, is discovered.",80.0,Hiromasa Yonebayashi,Amy Poehler,Mirai Shida,Ryûnosuke Kamiki,Tatsuya Fujiwara,80939,19202743.0
Avengers: Infinity War,2018,UA,149,"['Action', 'Adventure', 'Sci-Fi']",8.4,The Avengers and their allies must be willing to sacrifice all in an attempt to defeat the powerful Thanos before his blitz of devastation and ruin puts an end to the universe.,68.0,Anthony Russo,Joe Russo,Robert Downey Jr.,Chris Hemsworth,Mark Ruffalo,834477,678815482.0
Dom za vesanje,1988,R,142,"['Comedy', 'Crime', 'Drama']",8.2,"In this luminous tale set in the area around Sarajevo and in Italy, Perhan, an engaging young Romany (gypsy) with telekinetic powers, is seduced by the quick-cash world of petty crime, which threatens to destroy him and those he loves.",80.0,Emir Kusturica,Davor Dujmovic,Bora Todorovic,Ljubica Adzovic,Husnija Hasimovic,26402,280015.0
The Truman Show,1998,U,103,"['Comedy', 'Drama']",8.1,An insurance salesman discovers his whole life is actually a reality TV show.,90.0,Peter Weir,Jim Carrey,Ed Harris,Laura Linney,Noah Emmerich,939631,125618201.0
Primal Fear,1996,A,129,"['Crime', 'Drama', 'Mystery']",7.7,"An altar boy is accused of murdering a priest, and the truth is buried several layers deep.",47.0,Gregory Hoblit,Richard Gere,Laura Linney,Edward Norton,John Mahoney,189716,56116183.0
Tropa de Elite 2: O Inimigo Agora é Outro,2010,Unrated,115,"['Action', 'Crime', 'Drama']",8.0,"After a prison riot, former-Captain Nascimento, now a high ranking security officer in Rio de Janeiro, is swept into a bloody political dispute that involves government officials and paramilitary groups.",71.0,José Padilha,Wagner Moura,Irandhir Santos,André Ramiro,Milhem Cortaz,79200,100119.0
Toy Story 4,2019,U,100,"['Animation', 'Adventure', 'Comedy']",7.8,"When a new toy called ""Forky"" joins Woody and the gang, a road trip alongside old and new friends reveals how big the world can be for a toy.",84.0,Josh Cooley,Tom Hanks,Tim Allen,Annie Potts,Tony Hale,203177,434038008.0
Sunrise: A Song of Two Humans,1927,Passed,94,"['Drama', 'Romance']",8.1,An allegorical tale about a man fighting the good and evil within him. Both sides are made flesh - one a sophisticated woman he is attracted to and the other his wife.,80.0,F.W. Murnau,George O'Brien,Janet Gaynor,Margaret Livingston,Bodil Rosing,46865,539540.0
Little Miss Sunshine,2006,UA,101,"['Comedy', 'Drama']",7.8,A family determined to get their young daughter into the finals of a beauty pageant take a cross-country trip in their VW bus.,80.0,Jonathan Dayton,Valerie Faris,Steve Carell,Toni Collette,Greg Kinnear,439856,59891098.0
The Wild Bunch,1969,A,145,"['Action', 'Adventure', 'Western']",7.9,"An aging group of outlaws look for one last big score as the ""traditional"" American West is disappearing around them.",97.0,Sam Peckinpah,William Holden,Ernest Borgnine,Robert Ryan,Edmond O'Brien,77401,12064472.0
Avatar,2009,UA,162,"['Action', 'Adventure', 'Fantasy']",7.8,A paraplegic Marine dispatched to the moon Pandora on a unique mission becomes torn between following his orders and protecting the world he feels is his home.,83.0,James Cameron,Sam Worthington,Zoe Saldana,Sigourney Weaver,Michelle Rodriguez,1118998,760507625.0
The Day of the Jackal,1973,A,143,"['Crime', 'Drama', 'Thriller']",7.8,"A professional assassin codenamed ""Jackal"" plots to kill Charles de Gaulle, the President of France.",80.0,Fred Zinnemann,Edward Fox,Terence Alexander,Michel Auclair,Alan Badel,37445,16056255.0
A Beautiful Mind,2001,UA,135,"['Biography', 'Drama']",8.2,"After John Nash, a brilliant but asocial mathematician, accepts secret work in cryptography, his life takes a turn for the nightmarish.",72.0,Ron Howard,Russell Crowe,Ed Harris,Jennifer Connelly,Christopher Plummer,848920,170742341.0
Ah-ga-ssi,2016,A,145,"['Drama', 'Romance', 'Thriller']",8.1,"A woman is hired as a handmaiden to a Japanese heiress, but secretly she is involved in a plot to defraud her.",84.0,Chan-wook Park,Kim Min-hee,Jung-woo Ha,Cho Jin-woong,Moon So-Ri,113649,2006788.0
The Fugitive,1993,U,130,"['Action', 'Crime', 'Drama']",7.8,"Dr. Richard Kimble, unjustly accused of murdering his wife, must find the real killer while being the target of a nationwide manhunt led by a seasoned U.S. Marshal.",87.0,Andrew Davis,Harrison Ford,Tommy Lee Jones,Sela Ward,Julianne Moore,267684,183875760.0
Moonrise Kingdom,2012,A,94,"['Comedy', 'Drama', 'Romance']",7.8,"A pair of young lovers flee their New England town, which causes a local search party to fan out to find them.",84.0,Wes Anderson,Jared Gilman,Kara Hayward,Bruce Willis,Bill Murray,318789,45512466.0
Adaptation.,2002,R,115,"['Comedy', 'Drama']",7.7,A lovelorn screenwriter becomes desperate as he tries and fails to adapt 'The Orchid Thief' by Susan Orlean for the screen.,83.0,Spike Jonze,Nicolas Cage,Meryl Streep,Chris Cooper,Tilda Swinton,178565,22245861.0
Vizontele,2001,Unrated,110,"['Comedy', 'Drama']",8.0,Lives of residents in a small Anatolian village change when television is introduced to them,80.0,Yilmaz Erdogan,Ömer Faruk Sorak,Yilmaz Erdogan,Demet Akbag,Altan Erkekli,33592,22350918.5
21 Grams,2003,UA,124,"['Crime', 'Drama', 'Thriller']",7.6,"A freak accident brings together a critically ill mathematician, a grieving mother, and a born-again ex-con.",70.0,Alejandro G. Iñárritu,Sean Penn,Benicio Del Toro,Naomi Watts,Danny Huston,224545,16290476.0
Planet of the Apes,1968,U,112,"['Adventure', 'Sci-Fi']",8.0,"An astronaut crew crash-lands on a planet in the distant future where intelligent talking apes are the dominant species, and humans are the oppressed and enslaved.",79.0,Franklin J. Schaffner,Charlton Heston,Roddy McDowall,Kim Hunter,Maurice Evans,165167,33395426.0
Mommy,2014,R,139,['Drama'],8.1,"A widowed single mother, raising her violent son alone, finds new hope when a mysterious neighbor inserts herself into their household.",74.0,Xavier Dolan,Anne Dorval,Antoine Olivier Pilon,Suzanne Clément,Patrick Huard,50700,3492754.0
Udta Punjab,2016,A,148,"['Action', 'Crime', 'Drama']",7.8,A story that revolves around drug abuse in the affluent north Indian State of Punjab and how the youth there have succumbed to it en-masse resulting in a socio-economic decline.,80.0,Abhishek Chaubey,Shahid Kapoor,Alia Bhatt,Kareena Kapoor,Diljit Dosanjh,27175,22350918.5
Stand by Me,1986,U,89,"['Adventure', 'Drama']",8.1,"After the death of one of his friends, a writer recounts a childhood journey with his friends to find the body of a missing boy.",75.0,Rob Reiner,Wil Wheaton,River Phoenix,Corey Feldman,Jerry O'Connell,363401,52287414.0
Rockstar,2011,UA,159,"['Drama', 'Music', 'Musical']",7.7,"Janardhan Jakhar chases his dreams of becoming a big Rock star, during which he falls in love with Heer.",80.0,Imtiaz Ali,Ranbir Kapoor,Nargis Fakhri,Shammi Kapoor,Kumud Mishra,39501,985912.0
Tengoku to jigoku,1963,Unrated,143,"['Crime', 'Drama', 'Mystery']",8.4,An executive of a shoe company becomes a victim of extortion when his chauffeur's son is kidnapped and held for ransom.,80.0,Akira Kurosawa,Toshirô Mifune,Yutaka Sada,Tatsuya Nakadai,Kyôko Kagawa,34357,22350918.5
The Quiet Man,1952,Passed,129,"['Comedy', 'Drama', 'Romance']",7.7,"A retired American boxer returns to the village of his birth in Ireland, where he falls for a spirited redhead whose brother is contemptuous of their union.",80.0,John Ford,John Wayne,Maureen O'Hara,Barry Fitzgerald,Ward Bond,34677,10550000.0
Walk the Line,2005,PG-13,136,"['Biography', 'Drama', 'Music']",7.8,"A chronicle of country music legend Johnny Cash's life, from his early days on an Arkansas cotton farm to his rise to fame with Sun Records in Memphis, where he recorded alongside Elvis Presley, Jerry Lee Lewis, and Carl Perkins.",72.0,James Mangold,Joaquin Phoenix,Reese Witherspoon,Ginnifer Goodwin,Robert Patrick,234207,119519402.0
The Untouchables,1987,A,119,"['Crime', 'Drama', 'Thriller']",7.9,"During the era of Prohibition in the United States, Federal Agent Eliot Ness sets out to stop ruthless Chicago gangster Al Capone and, because of rampant corruption, assembles a small, hand-picked team to help him.",79.0,Brian De Palma,Kevin Costner,Sean Connery,Robert De Niro,Charles Martin Smith,281842,76270454.0
Lola rennt,1998,UA,81,"['Crime', 'Drama', 'Thriller']",7.6,"After a botched money delivery, Lola has 20 minutes to come up with 100,000 Deutschmarks.",77.0,Tom Tykwer,Franka Potente,Moritz Bleibtreu,Herbert Knaup,Nina Petri,188317,7267585.0
Saving Private Ryan,1998,R,169,"['Drama', 'War']",8.6,"Following the Normandy Landings, a group of U.S. soldiers go behind enemy lines to retrieve a paratrooper whose brothers have been killed in action.",91.0,Steven Spielberg,Tom Hanks,Matt Damon,Tom Sizemore,Edward Burns,1235804,216540909.0
Shichinin no samurai,1954,U,207,"['Action', 'Adventure', 'Drama']",8.6,A poor village under attack by bandits recruits seven unemployed samurai to help them defend themselves.,98.0,Akira Kurosawa,Toshirô Mifune,Takashi Shimura,Keiko Tsushima,Yukiko Shimazaki,315744,269061.0
Lion,2016,U,118,"['Biography', 'Drama']",8.0,"A five-year-old Indian boy is adopted by an Australian couple after getting lost hundreds of kilometers from home. 25 years later, he sets out to find his lost family.",69.0,Garth Davis,Dev Patel,Nicole Kidman,Rooney Mara,Sunny Pawar,213970,51739495.0
Forrest Gump,1994,UA,142,"['Drama', 'Romance']",8.8,"The presidencies of Kennedy and Johnson, the events of Vietnam, Watergate and other historical events unfold through the perspective of an Alabama man with an IQ of 75, whose only desire is to be reunited with his childhood sweetheart.",82.0,Robert Zemeckis,Tom Hanks,Robin Wright,Gary Sinise,Sally Field,1809221,330252182.0
"Aguirre, der Zorn Gottes",1972,Unrated,95,"['Action', 'Adventure', 'Biography']",7.9,"In the 16th century, the ruthless and insane Don Lope de Aguirre leads a Spanish expedition in search of El Dorado.",80.0,Werner Herzog,Klaus Kinski,Ruy Guerra,Helena Rojo,Del Negro,52397,22350918.5
Patton,1970,U,172,"['Biography', 'Drama', 'War']",7.9,The World War II phase of the career of controversial American general George S. Patton.,91.0,Franklin J. Schaffner,George C. Scott,Karl Malden,Stephen Young,Michael Strong,93741,61700000.0
Captain America: The Winter Soldier,2014,UA,136,"['Action', 'Adventure', 'Sci-Fi']",7.7,"As Steve Rogers struggles to embrace his role in the modern world, he teams up with a fellow Avenger and S.H.I.E.L.D agent, Black Widow, to battle a new threat from history: an assassin known as the Winter Soldier.",70.0,Anthony Russo,Joe Russo,Chris Evans,Samuel L. Jackson,Scarlett Johansson,736182,259766572.0
Vikram Vedha,2017,UA,147,"['Action', 'Crime', 'Drama']",8.4,"Vikram, a no-nonsense police officer, accompanied by Simon, his partner, is on the hunt to capture Vedha, a smuggler and a murderer. Vedha tries to change Vikram's life, which leads to a conflict.",80.0,Gayatri,Pushkar,Madhavan,Vijay Sethupathi,Shraddha Srinath,28401,22350918.5
Evil Dead II,1987,A,84,"['Action', 'Comedy', 'Fantasy']",7.8,The lone survivor of an onslaught of flesh-possessing spirits holes up in a cabin with a group of strangers while the demons continue their attack.,72.0,Sam Raimi,Bruce Campbell,Sarah Berry,Dan Hicks,Kassie Wesley DePaiva,148359,5923044.0
The African Queen,1951,PG,105,"['Adventure', 'Drama', 'Romance']",7.7,"In WWI Africa, a gin-swilling riverboat captain is persuaded by a strait-laced missionary to use his boat to attack an enemy warship.",91.0,John Huston,Humphrey Bogart,Katharine Hepburn,Robert Morley,Peter Bull,71481,536118.0
Mulholland Dr.,2001,R,147,"['Drama', 'Mystery', 'Thriller']",7.9,"After a car wreck on the winding Mulholland Drive renders a woman amnesiac, she and a perky Hollywood-hopeful search for clues and answers across Los Angeles in a twisting venture beyond dreams and reality.",85.0,David Lynch,Naomi Watts,Laura Harring,Justin Theroux,Jeanne Bates,322031,7220243.0
À bout de souffle,1960,U,90,"['Crime', 'Drama']",7.8,"A small-time thief steals a car and impulsively murders a motorcycle policeman. Wanted by the authorities, he reunites with a hip American journalism student and attempts to persuade her to run away with him to Italy.",80.0,Jean-Luc Godard,Jean-Paul Belmondo,Jean Seberg,Daniel Boulanger,Henri-Jacques Huet,73251,336705.0
Mar adentro,2014,U,126,"['Biography', 'Drama']",8.0,"The factual story of Spaniard Ramon Sampedro, who fought a thirty-year campaign in favor of euthanasia and his own right to die.",74.0,Alejandro Amenábar,Javier Bardem,Belén Rueda,Lola Dueñas,Mabel Rivera,77554,2086345.0
Hable con ella,2002,R,112,"['Drama', 'Mystery', 'Romance']",7.9,Two men share an odd friendship while they care for two women who are both in deep comas.,86.0,Pedro Almodóvar,Rosario Flores,Javier Cámara,Darío Grandinetti,Leonor Watling,104691,9284265.0
To Have and Have Not,1944,PG,100,"['Adventure', 'Comedy', 'Film-Noir']",7.8,"During World War II, American expatriate Harry Morgan helps transport a French Resistance leader and his beautiful wife to Martinique while romancing a sensuous lounge singer.",80.0,Howard Hawks,Humphrey Bogart,Lauren Bacall,Walter Brennan,Dolores Moran,31053,22350918.5
Chung Hing sam lam,1994,U,102,"['Comedy', 'Crime', 'Drama']",8.1,"Two melancholy Hong Kong policemen fall in love: one with a mysterious female underworld figure, the other with a beautiful and ethereal server at a late-night restaurant he frequents.",77.0,Kar-Wai Wong,Brigitte Lin,Takeshi Kaneshiro,Tony Chiu-Wai Leung,Faye Wong,63122,600200.0
Gifted,2017,PG-13,101,['Drama'],7.6,"Frank, a single man raising his child prodigy niece Mary, is drawn into a custody battle with his mother.",60.0,Marc Webb,Chris Evans,Mckenna Grace,Lindsay Duncan,Octavia Spencer,99643,24801212.0
Requiem for a Dream,2000,A,102,['Drama'],8.3,The drug-induced utopias of four Coney Island people are shattered when their addictions run deep.,68.0,Darren Aronofsky,Ellen Burstyn,Jared Leto,Jennifer Connelly,Marlon Wayans,766870,3635482.0
Scarface,1983,A,170,"['Crime', 'Drama']",8.3,"In 1980 Miami, a determined Cuban immigrant takes over a drug cartel and succumbs to greed.",65.0,Brian De Palma,Al Pacino,Michelle Pfeiffer,Steven Bauer,Mary Elizabeth Mastrantonio,740911,45598982.0
Shrek,2001,U,90,"['Animation', 'Adventure', 'Comedy']",7.8,"A mean lord exiles fairytale creatures to the swamp of a grumpy ogre, who must go on a quest and rescue a princess for the lord in order to get his land back.",84.0,Andrew Adamson,Vicky Jenson,Mike Myers,Eddie Murphy,Cameron Diaz,613941,267665011.0
Höstsonaten,1978,U,99,"['Drama', 'Music']",8.2,"A married daughter who longs for her mother's love is visited by the latter, a successful concert pianist.",80.0,Ingmar Bergman,Ingrid Bergman,Liv Ullmann,Lena Nyman,Halvar Björk,26875,22350918.5
Jûbê ninpûchô,1993,A,94,"['Animation', 'Action', 'Adventure']",7.9,A vagabond swordsman is aided by a beautiful ninja girl and a crafty spy in confronting a demonic clan of killers - with a ghost from his past as their leader - who are bent on overthrowing the Tokugawa Shogunate.,80.0,Yoshiaki Kawajiri,Kôichi Yamadera,Emi Shinohara,Takeshi Aono,Osamu Saka,34529,22350918.5
Sherlock Holmes,2009,PG-13,128,"['Action', 'Adventure', 'Mystery']",7.6,Detective Sherlock Holmes and his stalwart partner Watson engage in a battle of wits and brawn with a nemesis whose plot is a threat to all of England.,57.0,Guy Ritchie,Robert Downey Jr.,Jude Law,Rachel McAdams,Mark Strong,583158,209028679.0
American History X,1998,R,119,['Drama'],8.5,A former neo-nazi skinhead tries to prevent his younger brother from going down the same wrong path that he did.,62.0,Tony Kaye,Edward Norton,Edward Furlong,Beverly D'Angelo,Jennifer Lien,1034705,6719864.0
Bride of Frankenstein,1935,Unrated,75,"['Drama', 'Horror', 'Sci-Fi']",7.8,"Mary Shelley reveals the main characters of her novel survived: Dr. Frankenstein, goaded by an even madder scientist, builds his monster a mate.",95.0,James Whale,Boris Karloff,Elsa Lanchester,Colin Clive,Valerie Hobson,43542,4360000.0
Carlito's Way,1993,A,144,"['Crime', 'Drama', 'Thriller']",7.9,"A Puerto Rican former convict, just released from prison, pledges to stay away from drugs and violence despite the pressure around him and lead on to a better life outside of N.Y.C.",65.0,Brian De Palma,Al Pacino,Sean Penn,Penelope Ann Miller,John Leguizamo,201000,36948322.0
When Harry Met Sally...,1989,UA,95,"['Comedy', 'Drama', 'Romance']",7.6,"Harry and Sally have known each other for years, and are very good friends, but they fear sex would ruin the friendship.",76.0,Rob Reiner,Billy Crystal,Meg Ryan,Carrie Fisher,Bruno Kirby,195663,92823600.0
The Lives of Others,2006,A,137,"['Drama', 'Mystery', 'Thriller']",8.4,"In 1984 East Berlin, an agent of the secret police, conducting surveillance on a writer and his lover, finds himself becoming increasingly absorbed by their lives.",89.0,Florian Henckel von Donnersmarck,Ulrich Mühe,Martina Gedeck,Sebastian Koch,Ulrich Tukur,358685,11286112.0
Notorious,1946,U,102,"['Drama', 'Film-Noir', 'Romance']",7.9,A woman is asked to spy on a group of Nazi friends in South America. How far will she have to go to ingratiate herself with them?,100.0,Alfred Hitchcock,Cary Grant,Ingrid Bergman,Claude Rains,Louis Calhern,92306,10464000.0
Oldeuboi,2003,A,101,"['Action', 'Drama', 'Mystery']",8.4,"After being kidnapped and imprisoned for fifteen years, Oh Dae-Su is released, only to find that he must find his captor in five days.",77.0,Chan-wook Park,Choi Min-sik,Yoo Ji-Tae,Kang Hye-jeong,Kim Byeong-Ok,515451,707481.0
The Florida Project,2017,A,111,['Drama'],7.6,"Set over one summer, the film follows precocious six-year-old Moonee as she courts mischief and adventure with her ragtag playmates and bonds with her rebellious but caring mother, all while living in the shadows of Walt Disney World.",92.0,Sean Baker,Brooklynn Prince,Bria Vinaite,Willem Dafoe,Christopher Rivera,95181,5904366.0
Nefes: Vatan Sagolsun,2009,Unrated,128,"['Action', 'Drama', 'Thriller']",8.0,Story of 40-man Turkish task force who must defend a relay station.,80.0,Levent Semerci,Erdem Can,Mete Horozoglu,Ilker Kizmaz,Baris Bagci,31838,22350918.5
